{
  "sourceFile": "index.css",
  "selectors": [
    ".spectrum-Tray",
    ".spectrum-Tray .spectrum-Dialog",
    ".spectrum-Tray-wrapper",
    ".spectrum-Tray.is-open"
  ],
  "modifiers": {
    "mod-tray-max-inline-size": {
      "description": "Used by `--spectrum-tray-max-inline-size`.",
      "control": "text",
      "category": "Modifier"
    },
    "mod-tray-spacing-edge-to-tray-safe-zone": {
      "description": "Used by `--spectrum-tray-spacing-edge-to-tray-safe-zone`.",
      "control": "text",
      "category": "Modifier"
    },
    "mod-tray-entry-animation-delay": {
      "description": "Used by `--spectrum-tray-entry-animation-delay`.",
      "control": "text",
      "category": "Modifier"
    },
    "mod-tray-entry-animation-duration": {
      "value": "var(--spectrum-animation-duration-500)",
      "description": "Used by `--spectrum-tray-entry-animation-duration`. <br/>Defaults to `var(--spectrum-animation-duration-500)`, if not set.",
      "control": "text",
      "category": "Modifier"
    },
    "mod-tray-exit-animation-delay": {
      "description": "Used by `--spectrum-tray-exit-animation-delay`.",
      "control": "text",
      "category": "Modifier"
    },
    "mod-tray-exit-animation-duration": {
      "value": "var(--spectrum-animation-duration-100)",
      "description": "Used by `--spectrum-tray-exit-animation-duration`. <br/>Defaults to `var(--spectrum-animation-duration-100)`, if not set.",
      "control": "text",
      "category": "Modifier"
    },
    "mod-tray-corner-radius": {
      "value": "8px",
      "description": "Used by `--spectrum-tray-corner-radius`. <br/>Defaults to `var(--spectrum-corner-radius-100)`, if not set.",
      "control": "text",
      "category": "Modifier"
    },
    "mod-tray-background-color": {
      "value": "var(--spectrum-gray-75)",
      "description": "Used by `--spectrum-tray-background-color`. <br/>Defaults to `var(--spectrum-background-layer-2-color)`, if not set.",
      "control": "color",
      "category": "Modifier"
    },
    "mod-tray-top-to-content-area": {
      "value": "4px",
      "description": "Used by `.spectrum-Tray`. <br/>Defaults to `var(--spectrum-tray-top-to-content-area)`, if not set.",
      "control": "text",
      "category": "Modifier"
    },
    "mod-tray-bottom-to-content-area": {
      "value": "4px",
      "description": "Used by `.spectrum-Tray`. <br/>Defaults to `var(--spectrum-tray-top-to-content-area)`, if not set.",
      "control": "text",
      "category": "Modifier"
    },
    "mod-tray-corner-radius-portrait": {
      "description": "Used by `.spectrum-Tray`.",
      "control": "text",
      "category": "Modifier"
    }
  },
  "component": {
    "spectrum-tray-max-inline-size": {
      "description": "Defined in `.spectrum-Tray`. <br/>Used by `.spectrum-Tray`.",
      "control": "text",
      "category": "Component"
    },
    "spectrum-tray-spacing-edge-to-tray-safe-zone": {
      "description": "Defined in `.spectrum-Tray`. <br/>Used by `.spectrum-Tray`.",
      "control": "text",
      "category": "Component"
    },
    "spectrum-tray-entry-animation-delay": {
      "description": "Defined in `.spectrum-Tray`. <br/>Used by `.spectrum-Tray.is-open`.",
      "control": "text",
      "category": "Component"
    },
    "spectrum-tray-entry-animation-duration": {
      "description": "Defined in `.spectrum-Tray`. <br/>Used by `.spectrum-Tray.is-open`.",
      "control": "text",
      "category": "Component"
    },
    "spectrum-tray-exit-animation-delay": {
      "description": "Defined in `.spectrum-Tray`. <br/>Used by `.spectrum-Tray`.",
      "control": "text",
      "category": "Component"
    },
    "spectrum-tray-exit-animation-duration": {
      "description": "Defined in `.spectrum-Tray`. <br/>Used by `.spectrum-Tray`.",
      "control": "text",
      "category": "Component"
    },
    "spectrum-tray-corner-radius": {
      "description": "Defined in `.spectrum-Tray`. <br/>Used by `.spectrum-Tray`.",
      "control": "text",
      "category": "Component"
    },
    "spectrum-tray-background-color": {
      "description": "Defined in `.spectrum-Tray`. <br/>Used by `.spectrum-Tray`.",
      "control": "color",
      "category": "Component"
    },
    "spectrum-tray-top-to-content-area": {
      "value": "4px",
      "description": "Used by `.spectrum-Tray`.",
      "control": "text",
      "category": "Component"
    }
  },
  "global": {
    "spectrum-animation-duration-500": {
      "description": "Used by `--spectrum-tray-entry-animation-duration`.",
      "control": "text",
      "category": "Global"
    },
    "spectrum-animation-duration-100": {
      "description": "Used by `--spectrum-tray-exit-animation-duration`.",
      "control": "text",
      "category": "Global"
    },
    "spectrum-corner-radius-100": {
      "value": "8px",
      "description": "Used by `--spectrum-tray-corner-radius`.",
      "control": "text",
      "category": "Global"
    },
    "spectrum-background-layer-2-color": {
      "value": "var(--spectrum-gray-75)",
      "description": "Used by `--spectrum-tray-background-color`.",
      "control": "color",
      "category": "Global"
    }
  },
  "system-theme": {},
  "passthroughs": {
    "mod-modal-max-width": {
      "category": "Passthrough"
    }
  },
  "high-contrast": {
    "highcontrast-tray-background-color": {
      "value": "var(--mod-tray-background-color, var(--spectrum-background-layer-2-color))",
      "description": "Defined in `.spectrum-Tray`. <br/>Used by `--spectrum-tray-background-color`. <br/>Defaults to `var(--mod-tray-background-color, var(--spectrum-background-layer-2-color))`, if not set.",
      "control": "color"
    }
  }
}
