{
  "sourceFile": "index.css",
  "selectors": [
    ".spectrum-FieldGroup",
    ".spectrum-FieldGroup--horizontal .spectrum-FieldGroupInputLayout",
    ".spectrum-FieldGroup--horizontal .spectrum-FieldGroupInputLayout .spectrum-FieldGroup-item:not(:last-child)",
    ".spectrum-FieldGroup--horizontal .spectrum-FieldGroupInputLayout .spectrum-HelpText",
    ".spectrum-FieldGroup--sidelabel",
    ".spectrum-FieldGroup--toplabel",
    ".spectrum-FieldGroup--vertical .spectrum-FieldGroupInputLayout",
    ".spectrum-FieldGroupInputLayout"
  ],
  "modifiers": {},
  "component": {},
  "global": {
    "spectrum-spacing-300": {
      "value": "16px",
      "description": "Used by `.spectrum-FieldGroup--horizontal .spectrum-FieldGroupInputLayout .spectrum-FieldGroup-item:not(:last-child)`.",
      "control": "text",
      "category": "Global"
    }
  },
  "system-theme": {},
  "passthroughs": {},
  "high-contrast": {}
}
