{
  "sourceFile": "index.css",
  "selectors": [
    ".spectrum-MillerColumns",
    ".spectrum-MillerColumns-item",
    ".spectrum-MillerColumns-item:first-child"
  ],
  "modifiers": {
    "mod-millercolumns-padding": {
      "value": "8px",
      "description": "Used by `.spectrum-MillerColumns`. <br/>Defaults to `var(--spectrum-spacing-100)`, if not set.",
      "control": "text",
      "category": "Modifier"
    },
    "mod-millercolumns-inline-size": {
      "description": "Used by `.spectrum-MillerColumns-item`.",
      "control": "text",
      "category": "Modifier"
    },
    "mod-millercolumns-margin-inline-end": {
      "value": "8px",
      "description": "Used by `.spectrum-MillerColumns-item`. <br/>Defaults to `var(--spectrum-spacing-100)`, if not set.",
      "control": "text",
      "category": "Modifier"
    },
    "mod-millercolumns-margin-inline-start": {
      "value": "8px",
      "description": "Used by `.spectrum-MillerColumns-item:first-child`. <br/>Defaults to `var(--spectrum-spacing-100)`, if not set.",
      "control": "text",
      "category": "Modifier"
    }
  },
  "component": {},
  "global": {
    "spectrum-spacing-100": {
      "value": "8px",
      "description": "Used by `.spectrum-MillerColumns`, `.spectrum-MillerColumns-item`, `.spectrum-MillerColumns-item:first-child`.",
      "control": "text",
      "category": "Global"
    }
  },
  "system-theme": {},
  "passthroughs": {},
  "high-contrast": {}
}
