{
  "sourceFile": "index.css",
  "selectors": [
    ".spectrum-Link",
    ".spectrum-Link--quiet",
    ".spectrum-Link--quiet:hover",
    ".spectrum-Link--secondary",
    ".spectrum-Link--staticBlack",
    ".spectrum-Link--staticWhite",
    ".spectrum-Link:active",
    ".spectrum-Link:focus-visible",
    ".spectrum-Link:hover"
  ],
  "modifiers": {
    "mod-link-text-color": {
      "value": "var(--mod-link-text-color-black, var(--spectrum-black))",
      "description": "Defined in `.spectrum-Link--secondary`, `.spectrum-Link:active`, `.spectrum-Link:focus-visible`, `.spectrum-Link:hover`, `.spectrum-Link--staticWhite`, `.spectrum-Link--staticBlack`. Used by `.spectrum-Link`. Defaults to `var(--mod-link-text-color-primary-default, var(--spectrum-accent-content-color-default))`, if not set.",
      "control": "color",
      "category": "Modifier"
    },
    "mod-link-text-color-secondary-default": {
      "description": "Used by `--mod-link-text-color`. Defaults to `var(--spectrum-neutral-content-color-default)`, if not set.",
      "control": "color",
      "category": "Modifier"
    },
    "mod-link-text-color-hover": {
      "value": "var(--mod-link-text-color-black, var(--spectrum-black))",
      "description": "Defined in `.spectrum-Link--secondary`, `.spectrum-Link--staticWhite`, `.spectrum-Link--staticBlack`. Used by `--mod-link-text-color`. Defaults to `var(--mod-link-text-color-primary-hover, var(--spectrum-accent-content-color-hover))`, if not set.",
      "control": "color",
      "category": "Modifier"
    },
    "mod-link-text-color-secondary-hover": {
      "description": "Used by `--mod-link-text-color-hover`. Defaults to `var(--spectrum-neutral-content-color-hover)`, if not set.",
      "control": "color",
      "category": "Modifier"
    },
    "mod-link-text-color-active": {
      "value": "var(--mod-link-text-color-black, var(--spectrum-black))",
      "description": "Defined in `.spectrum-Link--secondary`, `.spectrum-Link--staticWhite`, `.spectrum-Link--staticBlack`. Used by `--mod-link-text-color`. Defaults to `var(--mod-link-text-color-primary-active, var(--spectrum-accent-content-color-down))`, if not set.",
      "control": "color",
      "category": "Modifier"
    },
    "mod-link-text-color-secondary-active": {
      "description": "Used by `--mod-link-text-color-active`. Defaults to `var(--spectrum-neutral-content-color-down)`, if not set.",
      "control": "color",
      "category": "Modifier"
    },
    "mod-link-text-color-focus": {
      "value": "var(--mod-link-text-color-black, var(--spectrum-black))",
      "description": "Defined in `.spectrum-Link--secondary`, `.spectrum-Link--staticWhite`, `.spectrum-Link--staticBlack`. Used by `--mod-link-text-color`. Defaults to `var(--mod-link-text-color-primary-focus, var(--spectrum-accent-content-color-key-focus))`, if not set.",
      "control": "color",
      "category": "Modifier"
    },
    "mod-link-text-color-secondary-focus": {
      "description": "Used by `--mod-link-text-color-focus`. Defaults to `var(--spectrum-neutral-content-color-key-focus)`, if not set.",
      "control": "color",
      "category": "Modifier"
    },
    "mod-link-animation-duration": {
      "description": "Used by `.spectrum-Link`. Defaults to `var(--spectrum-animation-duration-100)`, if not set.",
      "control": "text",
      "category": "Modifier"
    },
    "mod-link-text-color-primary-default": {
      "description": "Used by `.spectrum-Link`. Defaults to `var(--spectrum-accent-content-color-default)`, if not set.",
      "control": "color",
      "category": "Modifier"
    },
    "mod-link-text-color-primary-active": {
      "description": "Used by `--mod-link-text-color`. Defaults to `var(--spectrum-accent-content-color-down)`, if not set.",
      "control": "color",
      "category": "Modifier"
    },
    "mod-link-text-color-primary-focus": {
      "description": "Used by `--mod-link-text-color`. Defaults to `var(--spectrum-accent-content-color-key-focus)`, if not set.",
      "control": "color",
      "category": "Modifier"
    },
    "mod-link-text-color-primary-hover": {
      "description": "Used by `--mod-link-text-color`. Defaults to `var(--spectrum-accent-content-color-hover)`, if not set.",
      "control": "color",
      "category": "Modifier"
    },
    "mod-link-text-color-white": {
      "description": "Used by `--mod-link-text-color`, `--mod-link-text-color-hover`, `--mod-link-text-color-active`, `--mod-link-text-color-focus`. Defaults to `var(--spectrum-white)`, if not set.",
      "control": "color",
      "category": "Modifier"
    },
    "mod-link-text-color-black": {
      "description": "Used by `--mod-link-text-color`, `--mod-link-text-color-hover`, `--mod-link-text-color-active`, `--mod-link-text-color-focus`. Defaults to `var(--spectrum-black)`, if not set.",
      "control": "color",
      "category": "Modifier"
    }
  },
  "component": {},
  "global": {
    "spectrum-neutral-content-color-default": {
      "description": "Used by `--mod-link-text-color`.",
      "control": "color",
      "category": "Global"
    },
    "spectrum-neutral-content-color-hover": {
      "description": "Used by `--mod-link-text-color-hover`.",
      "control": "color",
      "category": "Global"
    },
    "spectrum-neutral-content-color-down": {
      "description": "Used by `--mod-link-text-color-active`.",
      "control": "color",
      "category": "Global"
    },
    "spectrum-neutral-content-color-key-focus": {
      "description": "Used by `--mod-link-text-color-focus`.",
      "control": "color",
      "category": "Global"
    },
    "spectrum-animation-duration-100": {
      "description": "Used by `.spectrum-Link`.",
      "control": "text",
      "category": "Global"
    },
    "spectrum-accent-content-color-default": {
      "description": "Used by `.spectrum-Link`.",
      "control": "color",
      "category": "Global"
    },
    "spectrum-accent-content-color-down": {
      "description": "Used by `--mod-link-text-color`.",
      "control": "color",
      "category": "Global"
    },
    "spectrum-accent-content-color-key-focus": {
      "description": "Used by `--mod-link-text-color`.",
      "control": "color",
      "category": "Global"
    },
    "spectrum-accent-content-color-hover": {
      "description": "Used by `--mod-link-text-color`.",
      "control": "color",
      "category": "Global"
    },
    "spectrum-white": {
      "description": "Used by `--mod-link-text-color`, `--mod-link-text-color-hover`, `--mod-link-text-color-active`, `--mod-link-text-color-focus`.",
      "control": "text",
      "category": "Global"
    },
    "spectrum-black": {
      "description": "Used by `--mod-link-text-color`, `--mod-link-text-color-hover`, `--mod-link-text-color-active`, `--mod-link-text-color-focus`.",
      "control": "text",
      "category": "Global"
    }
  },
  "system-theme": {},
  "passthroughs": {},
  "high-contrast": {
    "highcontrast-link-text-color": {
      "value": "LinkText",
      "description": "Defined in `.spectrum-Link`. Used by `.spectrum-Link`. Defaults to `var(--mod-link-text-color, var(--mod-link-text-color-primary-default, var(--spectrum-accent-content-color-default)))`, if not set.",
      "control": "color"
    }
  }
}
